{"authority":"CANONICAL_RECORD","campaign":"CAMPAIGN-GODDESS-SHARDBLADE-LESSON-HARVEST-R02","concurrency":{"declared_source_fingerprint":"sha256:98f9585a77c5d3718fd581ced0662c15167269cf0583522a888e4a48682a88d6","expected_main_sha":"aa72a3f8987ddebf064a8e1f7f22988fe838c160","expected_parent_feather":null,"expected_quest_revision":1},"context_summary":"The campaign repaired a semantic collision between Atlas Sunset and a low-level continuity command, established lesson-harvest governance and campaign control, enforced Feather/Sunset/Sunrise bindings, reconciled Prime Ascendant after PRs 236 and 237, and reached the final authored closeout without authorizing runtime, infrastructure, Gitea cutover, route retirement, or repository settings.","durable_source_references":[{"authority":"CANONICAL_SOURCE","digest":"sha256:54f9d8e6ef9235282829fcd0f91656f467c8b66300cc06659c3458efc2597ca4","ref_id":"prime-ascendant-quest","uri":"quests/prime-ascendant.md"},{"authority":"CANONICAL_SOURCE","digest":"sha256:f413e486cdcf0b0044845ed9ada5ef4a32a24c8be7199679ca6c2ebcd1202f3f","ref_id":"prime-ascendant-covenant","uri":"quests/prime-ascendant-covenant.md"},{"authority":"CANONICAL_SOURCE","digest":"sha256:53aa536bbc5e1e8833b640dea318bbbee5e8e19cf97c17e5633b7d6bee038c91","ref_id":"lesson-harvest-protocol","uri":"governance/lesson-harvest-protocol.md"},{"authority":"CANONICAL_SOURCE","digest":"sha256:1828c32ca24fec3e4d61225e4e22d7b15c81454968526b729259687dd3557000","ref_id":"prime-continuity-register","uri":"continuity/prime-continuity-register-r01.json"},{"authority":"CANONICAL_SOURCE","digest":"sha256:d795a000af1aee89b1681236c2019fd67497ce03df90f3b095732f6b4a9f4700","ref_id":"quest-board","uri":"quest-board/quest-board-v1.json"},{"authority":"CANONICAL_SOURCE","digest":"sha256:4a60520db7b26d1608b55a67cffbd9286765eca8ea8a5644870e92e55be8d516","ref_id":"campaign-warrant-schema","uri":"schemas/shardblade-campaign-warrant-v1.schema.json"},{"authority":"CANONICAL_SOURCE","digest":"sha256:8e3aa1ce6c597a83cdd25d7abdffbfb375442371fb72c284b08a5328d08150b5","ref_id":"campaign-stage-request-schema","uri":"schemas/shardblade-campaign-stage-request-v1.schema.json"},{"authority":"CANONICAL_SOURCE","digest":"sha256:289bcbef6553802307f1a68e895aeb3b64b80c9e40db4bf717252a454c6aab39","ref_id":"campaign-stage-receipt-schema","uri":"schemas/shardblade-campaign-stage-receipt-v1.schema.json"}],"evidence_pointers":[{"authority":"EVIDENCE_POINTER","digest":"sha256:c3dfe90181f3a79a00b43cf793b6c2c6070dca8c22839d909f98097c36997ed0","ref_id":"ascendant-reconciliation-tests","uri":"tests/prime-program/test_prime_ascendant_covenant.py"},{"authority":"EVIDENCE_POINTER","digest":"sha256:1c90c27cc6600251e3bb3cfe00b58a36d7c7cd910bb3e68b2e4c6435ffb9c573","ref_id":"campaign-control-tests","uri":"tests/prime-program/test_shardblade_campaign.py"}],"gate":"t4-final-chat-sunset","lesson_harvest":{"no_lesson_reason":null,"observations":[{"disposition":"LOCAL_ONLY","golden_wing_id":null,"key":"semantic-objective-collision","observation":"The chat exposed a terminology collision: a continuity snapshot command named sunset was substituted for Jayson's established full Atlas lifecycle Sunset.","rationale":"The correction is bound into this Feather and the merged lesson-harvest protocol. One observed collision does not independently justify a Golden Wing candidate."},{"disposition":"LOCAL_ONLY","golden_wing_id":null,"key":"sunset-feather-binding","observation":"PR 237 proved targeted continuity validation but created no lifecycle Feather, so it could not truthfully constitute the full chat Sunset; this transaction deterministically binds one v2 Feather, Sunset, and Sunrise.","rationale":"The binding is now a schema and runtime invariant. No separate Golden Wing is needed to restate the enforced lifecycle contract."},{"disposition":"LOCAL_ONLY","golden_wing_id":null,"key":"single-branch-writer","observation":"All six campaign stages use one active branch writer, a prior-stage merge base, and exact-head compare-and-swap checks before READY and MERGE.","rationale":"The control is enforced by the campaign runtime and schemas; the campaign supplies application evidence without a distinct systemic exception."},{"disposition":"LOCAL_ONLY","golden_wing_id":null,"key":"coherent-repair-batching","observation":"Transaction 3 collected three Copilot findings, repaired the case-normalization gap and two future-brittleness issues in one coherent local set, reran full validation, and then pushed one repair commit.","rationale":"The reviewer repair demonstrates the protocol in this campaign, but does not yet establish independent recurrence sufficient for a Golden Wing."},{"disposition":"LOCAL_ONLY","golden_wing_id":null,"key":"dependent-source-reconciliation","observation":"Transaction 3 reread PRs 236 and 237, then reconciled the Prime Ascendant Covenant and the exact continuity entry without changing the accepted PA-C01 state, gate, topology, or authority boundaries.","rationale":"The reconciliation is durable campaign evidence and remains local to the bound lesson until independent recurrence justifies broader promotion."},{"disposition":"LOCAL_ONLY","golden_wing_id":null,"key":"semantic-claim-alignment","observation":"The campaign required provenance labels, event IDs, paths, lifecycle claims, and completion language to match actual merged evidence; green checks alone were never accepted as proof of semantic truth.","rationale":"This control is merged into the lesson-harvest protocol and reviewed in context. No unbound or automatically absorbed Golden Wing is warranted."}],"schema_id":"atlas.lifecycle.lesson-harvest","schema_version":"1.0.0"},"lifecycle_status":"SEALED","mission":"t4-final-chat-sunset","next_approval_gate":"Transaction 5 may publish only the exact generated refresh from this merged source. After its canonical CURRENT readback, campaign authority expires; any Prime Ascendant runtime, infrastructure, Gitea, route-retirement, repository-settings, or further source action requires a new Jayson-approved warrant.","next_safe_action":"After this exact authored candidate merges and canonical main is verified, execute only Transaction 5's generated refresh, prove canonical generated state CURRENT, and expire the campaign authority.","operation_id":"operation-nexus","project_id":"project-artemis","protected_data":{"classification":"INTERNAL_CLEAN","clean_summary":"Only sanitized doctrine, public repository identities, exact public Git evidence, and clean evidence pointers are included. No credentials, private network values, PHI, raw finance data, unrestricted logs, or protected payloads are present.","protected_pointers":[]},"quest_scope":{"quest_id":"prime-ascendant","scope_type":"ADMITTED_QUEST"},"record_id":"FTR-SCFUZB37GJBLW4SL2JSH32LQBP","schema_id":"atlas.lifecycle.feather","schema_version":"2.0.0","supersession_lineage":{"superseded_by":null,"supersedes":[]}}
