{"authority":"CANONICAL_RECORD","campaign":"CAMPAIGN-CODEX-OPEN-PATHWAYS-SUNSET-R01","concurrency":{"declared_source_fingerprint":"sha256:876cdd208f0fae87bf0628b9f4a8147ffcb5a717fa534be070b2497278d0cb07","expected_main_sha":"6e48f5e3fba1e4a1bd826aa64602f616be5d5c89","expected_parent_feather":null,"expected_quest_revision":null},"context_summary":"Continue Mission 257 through Codex's separately available local clone execution surface while preserving the frozen Issue-comment ingress evidence, delegated non-Athena identity, Preview-first approval, governed publication, recovery, rollback, and canonical readback boundaries.","durable_source_references":[{"authority":"CANONICAL_SOURCE","ref_id":"sunset-router-contract","uri":"governance/sunset-router-contract.md"},{"authority":"CANONICAL_SOURCE","ref_id":"lifecycle-contract","uri":"lifecycle/lifecycle-contract.md"},{"authority":"CANONICAL_SOURCE","ref_id":"mission-board-contract","uri":"governance/mission-board-contract.md"},{"authority":"CANONICAL_SOURCE","ref_id":"recovery-contract","uri":"recovery/elantris-recovery.md"}],"evidence_pointers":[{"authority":"EVIDENCE_POINTER","ref_id":"stage2-router-proof","uri":"proof/mission-257/stage-2-sunset-router-r01.json"},{"authority":"EVIDENCE_POINTER","ref_id":"stage3-ingress-proof","uri":"proof/mission-257/stage-3-execution-surface-r01.json"}],"gate":"MISSION_257_EXACT_LOCAL_PREVIEW_APPROVAL","lesson_harvest":{"no_lesson_reason":null,"observations":[{"disposition":"LOCAL_ONLY","golden_wing_id":null,"key":"local-preview-preserves-route-identity","observation":"A separately available local read-only execution surface can generate the canonical Sunset Preview without relabeling the frozen hosted ingress or any repository publisher, and the transaction must stop for exact unchanged Preview approval.","rationale":"This is transaction-specific acceptance evidence; it does not establish a reusable route, standing authority, or a promoted safeguard."}],"schema_id":"atlas.lifecycle.lesson-harvest","schema_version":"1.0.0"},"lifecycle_status":"SEALED","mission":"Mission #257 Stage 3 local Sunset Router acceptance","next_approval_gate":"Jayson must approve the exact unchanged Preview ID, Preview digest, and semantic digest with the selected permanence mode.","next_safe_action":"Post the exact lifecycle Preview and Router bindings to Mission 257, then stop until Jayson approves the unchanged Preview.","operation_id":"operation-source-governance","project_id":"project-codex","protected_data":{"classification":"PUBLIC","clean_summary":"Only public Mission coordination, canonical repository references, and sanitized lifecycle acceptance evidence are included.","protected_pointers":[]},"quest_scope":{"scope_type":"NON_QUEST","work_scope":"Mission 257 Stage 3 local Sunset Router acceptance and eventual governed lifecycle closeout."},"record_id":"FTR-KG23DANMBMXCKERGICOJUVQHSB","schema_id":"atlas.lifecycle.feather","schema_version":"2.0.0","supersession_lineage":{"superseded_by":null,"supersedes":[]}}
