{"authority":"CANONICAL_RECORD","campaign":"cross-quest-continuity","concurrency":{"declared_source_fingerprint":"sha256:a26c9135a05d08c5b57f1fd87f2700796b26c0874a0e1fe2a27f3f3564edd84d","expected_main_sha":"9aa371f1e3ebadef018feecd46d55391bab793f1","expected_parent_feather":null,"expected_quest_revision":null},"context_summary":"Mission #316 seals the completed public-clean discussion of Prometheus and Grafana depth, Notum's independent lightweight monitoring role, Cloud Atlas responsibility boundaries, the replaceable Apollo–iCloud–Forge working-file bridge, Mission #313 and PR #314 completion, and Mission #315's now-canonical synchronization repair. It proves no runtime deployment, monitoring activation, UPS telemetry, protected import, Quest advancement, or platform cutover.","durable_source_references":[{"authority":"CANONICAL_SOURCE","ref_id":"mission-board-contract","uri":"governance/mission-board-contract.md"},{"authority":"CANONICAL_SOURCE","ref_id":"prime-ascendant-quest","uri":"quests/prime-ascendant.md"},{"authority":"CANONICAL_SOURCE","ref_id":"atlas-infrastructure-source","uri":"infrastructure/atlas-infrastructure-source.md"},{"authority":"CANONICAL_SOURCE","ref_id":"lifecycle-contract","uri":"lifecycle/lifecycle-contract.md"}],"evidence_pointers":[{"authority":"EVIDENCE_POINTER","ref_id":"mission-313","uri":"github/issues/313"},{"authority":"EVIDENCE_POINTER","ref_id":"pull-314","uri":"github/pulls/314"},{"authority":"EVIDENCE_POINTER","ref_id":"mission-315","uri":"github/issues/315"},{"authority":"EVIDENCE_POINTER","ref_id":"pull-320","uri":"github/pulls/320"},{"authority":"EVIDENCE_POINTER","ref_id":"mission-316","uri":"github/issues/316"}],"gate":"sunset-complete","lesson_harvest":{"no_lesson_reason":null,"observations":[{"disposition":"LOCAL_ONLY","golden_wing_id":null,"key":"quest-sync-enforcement","observation":"Post-merge parent-Quest synchronization must be mechanically enforced rather than left as a conversational follow-up.","rationale":"Mission #315 and PR #320 are now canonical, so this Sunset preserves the lesson without fabricating a Golden Wing or claiming pending absorption."},{"disposition":"LOCAL_ONLY","golden_wing_id":null,"key":"responsibility-separation","observation":"Prime, Mission Board, Coppermind, Emberdark, Harmony, and Perpendicularity require distinct source, evidence, ingest, analysis, and sanitized-transfer responsibilities.","rationale":"The responsibility boundary is already represented in routed canonical sources and Mission #313 evidence; no canonical Golden Wing currently exists for reinforcement binding."},{"disposition":"LOCAL_ONLY","golden_wing_id":null,"key":"independent-monitoring","observation":"A minimal independent Notum watchtower improves outage resilience when deeper Prometheus and Grafana analysis shares the primary substrate.","rationale":"The architecture is preserved as public-clean continuity while runtime placement, installation, telemetry, and alert activation remain unproven."},{"disposition":"LOCAL_ONLY","golden_wing_id":null,"key":"automatic-notum-continuity","observation":"Automatic Notum continuity control could reduce manual recovery steps.","rationale":"Automation remains deferred and has no runtime or protected proof."},{"disposition":"REJECTED","golden_wing_id":null,"key":"temporary-ci-debugging","observation":"Temporary CI timing, hash troubleshooting, and connector debugging should not become durable lifecycle doctrine.","rationale":"These were transient implementation details rather than reusable Atlas knowledge."}],"schema_id":"atlas.lifecycle.lesson-harvest","schema_version":"1.0.0"},"lifecycle_status":"SEALED","mission":"mission-316","next_approval_gate":"SEPARATE_AUTHORITY_REQUIRED","next_safe_action":"Use these records for future restart context; any runtime, protected, infrastructure, or Quest-state change requires a separate authorized Mission and exact proof.","operation_id":"operation-harmony","project_id":"project-artemis","protected_data":{"classification":"PUBLIC","clean_summary":"Public-clean repository, Mission, lifecycle, architecture, monitoring, and workflow context only; no protected values or runtime evidence are embedded.","protected_pointers":[]},"quest_scope":{"scope_type":"NON_QUEST","work_scope":"Cross-Quest continuity for Notum, monitoring, Cloud Atlas responsibilities, working-file bridge boundaries, and Mission Board synchronization."},"record_id":"FTR-YYT5EL7BHQAEHNSMIYEPDMTCDZ","schema_id":"atlas.lifecycle.feather","schema_version":"2.0.0","supersession_lineage":{"superseded_by":null,"supersedes":[]}}
