{"authority":"CANONICAL_RECORD","campaign":"PA-C01","concurrency":{"declared_source_fingerprint":"sha256:45a704eb4a7b8fff43ebb7982cacfb78de1c67533c3bedf9791380011a48f391","expected_main_sha":"d53070403a7cdd84d800cbf3519c3456f5e6f9bd","expected_parent_feather":"FTR-DI2NRWYNLEBRSNY7TX6F4YIFMY","expected_quest_revision":3},"context_summary":"Corrected compiler-valid Sunset Preview for the same Mission #338 attempt under Stormfather campaign Mission #340. Mission #339 and PR #341 are canonically complete and independently read back. The Relay design, Strikeforce findings, Stormfather campaign binding, and Mission Board evidence remain public-clean context.","durable_source_references":[{"authority":"CANONICAL_SOURCE","ref_id":"prime-ascendant-quest","uri":"quests/prime-ascendant.md"},{"authority":"CANONICAL_SOURCE","ref_id":"prime-ascendant-covenant","uri":"quests/prime-ascendant-covenant.md"},{"authority":"CANONICAL_SOURCE","ref_id":"mission-control-contract","uri":"governance/mission-control-interaction-contract.md"},{"authority":"CANONICAL_SOURCE","ref_id":"mission-first-handoff","uri":"governance/mission-first-chat-handoff-contract.md"},{"authority":"CANONICAL_SOURCE","ref_id":"lifecycle-contract","uri":"lifecycle/lifecycle-contract.md"},{"authority":"CANONICAL_SOURCE","ref_id":"sunset-router-contract","uri":"governance/sunset-router-contract.md"},{"authority":"CANONICAL_SOURCE","ref_id":"lesson-harvest-protocol","uri":"governance/lesson-harvest-protocol.md"},{"authority":"CANONICAL_SOURCE","ref_id":"prime-continuity-register","uri":"continuity/prime-continuity-register-r01.json"},{"authority":"CANONICAL_SOURCE","ref_id":"quest-registry","uri":"continuity/mission-board-quest-registry-r01.json"}],"evidence_pointers":[{"authority":"EVIDENCE_POINTER","ref_id":"mission-261","uri":"github/issues/261"},{"authority":"EVIDENCE_POINTER","ref_id":"mission-280","uri":"github/issues/280"},{"authority":"EVIDENCE_POINTER","ref_id":"mission-281","uri":"github/issues/281"},{"authority":"EVIDENCE_POINTER","ref_id":"mission-332","uri":"github/issues/332"},{"authority":"EVIDENCE_POINTER","ref_id":"mission-333","uri":"github/issues/333"},{"authority":"EVIDENCE_POINTER","ref_id":"mission-334","uri":"github/issues/334"},{"authority":"EVIDENCE_POINTER","ref_id":"mission-338","uri":"github/issues/338"},{"authority":"EVIDENCE_POINTER","ref_id":"pull-325","uri":"github/pulls/325"},{"authority":"EVIDENCE_POINTER","ref_id":"pull-326","uri":"github/pulls/326"},{"authority":"EVIDENCE_POINTER","ref_id":"pull-327","uri":"github/pulls/327"},{"authority":"EVIDENCE_POINTER","ref_id":"pull-335","uri":"github/pulls/335"},{"authority":"EVIDENCE_POINTER","ref_id":"pull-336","uri":"github/pulls/336"},{"authority":"EVIDENCE_POINTER","ref_id":"pull-337","uri":"github/pulls/337"},{"authority":"EVIDENCE_POINTER","ref_id":"mission-339","uri":"github/issues/339"},{"authority":"EVIDENCE_POINTER","ref_id":"mission-340","uri":"github/issues/340"},{"authority":"EVIDENCE_POINTER","ref_id":"pull-341","uri":"github/pulls/341"}],"gate":"PA-C01-COVENANT-REFINEMENT","lesson_harvest":{"no_lesson_reason":null,"observations":[{"disposition":"LOCAL_ONLY","golden_wing_id":null,"key":"mission-first-chat-handoff","observation":"Substantive chat work must become Mission-bound before execution, delegation, blocking, or durable continuation.","rationale":"Mission #334 and PR #335 already made this doctrine canonical; no resolving canonical Golden Wing exists, so no reinforcement binding or promotion is fabricated."},{"disposition":"NEW_CANDIDATE","golden_wing_id":null,"key":"fallback-route-exhaustion","observation":"A Mission cannot be declared route-exhausted while an approved fallback such as Aegis Break remains unevaluated.","rationale":"This chat repeatedly misclassified a Phoenix Blade checkout failure as a universal block. The lesson is preserved as a candidate only and does not self-promote into doctrine or an assurance control."},{"disposition":"LOCAL_ONLY","golden_wing_id":null,"key":"preview-exact-byte-verification","observation":"A Sunset approval gate must expose compiler-valid Preview, Preview receipt, Router plan, and Router receipt bytes whose identifiers and digests are independently recomputed before approval.","rationale":"Mission #338 R01 was rejected before candidate construction because its displayed digest did not bind complete compiler-generated artifacts; R02 corrects the transaction without promoting a new control."}],"schema_id":"atlas.lifecycle.lesson-harvest","schema_version":"1.0.0"},"lifecycle_status":"SEALED","mission":"MISSION-SUNSET-CHAT-FRESH-R01 / Issue #338 / Stormfather Stage 2","next_approval_gate":"Approve this exact corrected R03 Preview by Preview ID, Preview digest, semantic digest, and approval mode. All later Quest advancement, runtime, protected, infrastructure, Gitea, settings, and ruleset actions remain separately gated.","next_safe_action":"Obtain explicit exact approval bound to this complete compiler-valid corrected Preview. Do not construct a carrier, lifecycle candidate, branch, PR, READY transition, or merge before that approval is independently read back.","operation_id":"operation-harmony","project_id":"project-artemis","protected_data":{"classification":"INTERNAL_CLEAN","clean_summary":"Only public-clean repository, Mission, campaign, PR, lifecycle, decision, validation, blocker, dependency, rollback, and continuity identities are included.","protected_pointers":[]},"quest_scope":{"quest_id":"prime-ascendant","scope_type":"ADMITTED_QUEST"},"record_id":"FTR-DUXR2GP55SINPLJFGXMVTIU47D","schema_id":"atlas.lifecycle.feather","schema_version":"2.0.0","supersession_lineage":{"superseded_by":null,"supersedes":["FTR-DI2NRWYNLEBRSNY7TX6F4YIFMY"]}}
