{"authority":"CANONICAL_RECORD","campaign":"pa-c01","concurrency":{"declared_source_fingerprint":"sha256:ec05a7138cd3b1d2de857b78f5279185503ca80c140ea96bc876094d20c364c1","expected_main_sha":"bbd969e94416b559ba70351c8d2dc1da089b600a","expected_parent_feather":null,"expected_quest_revision":null},"context_summary":"Mission #319 seals the public-clean closeout of Mission Control, mobile Decision Boxes, Preview-first planning, risk-scaled Strikeforce, Goddess Mode, and Shardblade after Mission #317 and PR #318 completed. Missions #315 and #316 are now also complete. Generated lifecycle projection freshness remains unproven and no runtime, protected, Quest-state, or generated-current claim is made.","durable_source_references":[{"authority":"CANONICAL_SOURCE","ref_id":"mission-control-contract","uri":"governance/mission-control-interaction-contract.md"},{"authority":"CANONICAL_SOURCE","ref_id":"ares-contract","uri":"governance/ares.md"},{"authority":"CANONICAL_SOURCE","ref_id":"strikeforce-contract","uri":"governance/atlas-strikeforce.md"},{"authority":"CANONICAL_SOURCE","ref_id":"glass-codex-client-contract","uri":"governance/glass-codex-client-contract.md"},{"authority":"CANONICAL_SOURCE","ref_id":"lifecycle-contract","uri":"lifecycle/lifecycle-contract.md"}],"evidence_pointers":[{"authority":"EVIDENCE_POINTER","ref_id":"mission-317","uri":"github/issues/317"},{"authority":"EVIDENCE_POINTER","ref_id":"pull-318","uri":"github/pulls/318"},{"authority":"EVIDENCE_POINTER","ref_id":"mission-315","uri":"github/issues/315"},{"authority":"EVIDENCE_POINTER","ref_id":"pull-320","uri":"github/pulls/320"},{"authority":"EVIDENCE_POINTER","ref_id":"mission-316","uri":"github/issues/316"},{"authority":"EVIDENCE_POINTER","ref_id":"pull-321","uri":"github/pulls/321"},{"authority":"EVIDENCE_POINTER","ref_id":"mission-319","uri":"github/issues/319"}],"gate":"sunset-complete","lesson_harvest":{"no_lesson_reason":null,"observations":[{"disposition":"LOCAL_ONLY","golden_wing_id":null,"key":"preview-first-storage","observation":"A complete restart-safe Preview must be stored on the Mission Board before branch or pull-request construction.","rationale":"Mission #317 and PR #318 already made this rule canonical; no canonical Golden Wing exists for a reinforcement binding."},{"disposition":"LOCAL_ONLY","golden_wing_id":null,"key":"risk-scaled-strikeforce","observation":"Preview Strikeforce and exact-head Build Strikeforce answer different questions and remain risk-scaled.","rationale":"The distinction is already canonical in the Mission Control and Strikeforce contracts."},{"disposition":"LOCAL_ONLY","golden_wing_id":null,"key":"repair-preview-path-expansion","observation":"Discovered path expansion returns through Repair Preview before mutation.","rationale":"Mission #317 proved the behavior and PR #318 absorbed it into canonical workflow doctrine."},{"disposition":"LOCAL_ONLY","golden_wing_id":null,"key":"semantic-reconciliation","observation":"Passing tests does not replace semantic reconciliation against the accepted objective and restart-safe lifecycle.","rationale":"The rule is already represented in canonical Strikeforce and Mission Control doctrine."},{"disposition":"LOCAL_ONLY","golden_wing_id":null,"key":"goddess-shardblade-separation","observation":"Goddess Mode may continue bounded recoverable work, while Shardblade remains the unchanged exact-head permanence boundary.","rationale":"The authority separation is already canonical and this Sunset creates no new promotion candidate."},{"disposition":"REJECTED","golden_wing_id":null,"key":"temporary-review-quota","observation":"Copilot review quota exhaustion and temporary workflow timing should not become durable doctrine.","rationale":"They are transient environmental conditions rather than reusable Atlas knowledge."}],"schema_id":"atlas.lifecycle.lesson-harvest","schema_version":"1.0.0"},"lifecycle_status":"SEALED","mission":"mission-319","next_approval_gate":"SEPARATE_GENERATED_REFRESH_OR_NEW_MISSION","next_safe_action":"Use these records for restart context; refresh generated lifecycle projections only through a separate verified generated-refresh transaction.","operation_id":"operation-harmony","project_id":"project-artemis","protected_data":{"classification":"PUBLIC","clean_summary":"Public-clean repository, Mission, lifecycle, validation, generated-state, and workflow context only; no protected values or runtime evidence are embedded.","protected_pointers":[]},"quest_scope":{"scope_type":"NON_QUEST","work_scope":"Chat-closeout continuity for Mission Control, Decision Boxes, Preview-first planning, Strikeforce, Goddess Mode, and Shardblade boundaries."},"record_id":"FTR-FA7UPPVD7KEDTOEUYS3SKALQWP","schema_id":"atlas.lifecycle.feather","schema_version":"2.0.0","supersession_lineage":{"superseded_by":null,"supersedes":[]}}
