{"authority":"CANONICAL_RECORD","campaign":"PA-C01 — Write the Covenant","concurrency":{"declared_source_fingerprint":"sha256:85374d0649abd657c920ea48847883f3aeb7430c6b746857acb4c3dcd665b03d","expected_main_sha":"8d4991b30e9809cee4a7cd3db9fdea3a9b3941cd","expected_parent_feather":"FTR-SCFUZB37GJBLW4SL2JSH32LQBP","expected_quest_revision":2},"context_summary":"This normal full Atlas Sunset closes the chat while preserving the exact durable results and restart context. PR #245 merged the Atlas naming architecture refraction; PR #246 merged the deterministic generated refresh; and PR #247 merged Prime Integrity plus the future Gitea/Phoenix validation augmentation. Prime Ascendant is only the admitted-Quest continuity scope and remains ACTIVE — ARCHITECTURE REFINEMENT at PA-C01-COVENANT-REFINEMENT. Runtime is NOT STARTED, Gitea cutover is NOT AUTHORIZED, and legacy route retirement is NOT AUTHORIZED. The future validation route remains Gitea pull-request event to Prime Integrity Cognitive Shadow, immutable exact-base/exact-head carrier, bounded Kandra executor, conditional Windows executor, TenSoon verification, Phoenix draft/status publication, Athena audit, and Jayson-controlled permanence. No deployment, activation, settings, ruleset, cutover, runtime, or route-retirement action occurred.","durable_source_references":[{"authority":"CANONICAL_SOURCE","digest":"sha256:cc99c59d155f5fb09057b9ecdfd81b203919fee417c95985b6b15c5ad60088d2","ref_id":"prime-ascendant-quest","uri":"quests/prime-ascendant.md"},{"authority":"CANONICAL_SOURCE","digest":"sha256:878edadea46c67ce70cf5a6e4402b791010154ea4e219131a40c0bc211a6fea4","ref_id":"prime-ascendant-covenant","uri":"quests/prime-ascendant-covenant.md"},{"authority":"CANONICAL_SOURCE","digest":"sha256:4d16665bc75097fdb2485d27070b2d93e6c856d40cd3052f068c1b10aff8a9f9","ref_id":"lifecycle-contract","uri":"lifecycle/lifecycle-contract.md"},{"authority":"CANONICAL_SOURCE","digest":"sha256:cb532b4216333614773847a445f08e8b6e144c6362767d42fe06b805a09b1b51","ref_id":"lifecycle-construction-contract","uri":"lifecycle/lifecycle-construction-contract.md"},{"authority":"CANONICAL_SOURCE","digest":"sha256:53aa536bbc5e1e8833b640dea318bbbee5e8e19cf97c17e5633b7d6bee038c91","ref_id":"lesson-harvest-protocol","uri":"governance/lesson-harvest-protocol.md"},{"authority":"CANONICAL_SOURCE","digest":"sha256:b62714f7389c125e69487248c5636cc8cf2211a8999fc0f05c993197a24f00cd","ref_id":"assurance-controls","uri":"governance/assurance-controls.json"},{"authority":"CANONICAL_SOURCE","digest":"sha256:0d884bd8bcedc9834b4e258fe507f9e45dead3d736d82293c796a3a8bddccacb","ref_id":"quest-board","uri":"quest-board/quest-board-v1.json"},{"authority":"CANONICAL_SOURCE","digest":"sha256:0f488fbc21c6d8cef3e79767f97bdda5bb164050f6f82a8527ce93a4337e8baf","ref_id":"prime-continuity-register","uri":"continuity/prime-continuity-register-r01.json"},{"authority":"CANONICAL_SOURCE","digest":"sha256:6cc3fedb2f33fa345d8b70d34f3b0251927c10d5c23a230e5bef56b655f0ee60","ref_id":"prime-integrity-validation-doctrine","uri":"tools/prime_checks/targeted_validation.py"}],"evidence_pointers":[{"authority":"EVIDENCE_POINTER","digest":"sha256:cc99c59d155f5fb09057b9ecdfd81b203919fee417c95985b6b15c5ad60088d2","ref_id":"merged-pr-245-naming-architecture-refraction","uri":"quests/prime-ascendant.md"},{"authority":"EVIDENCE_POINTER","digest":"sha256:6cc3fedb2f33fa345d8b70d34f3b0251927c10d5c23a230e5bef56b655f0ee60","ref_id":"merged-pr-246-deterministic-generated-refresh","uri":"tools/prime_checks/targeted_validation.py"},{"authority":"EVIDENCE_POINTER","digest":"sha256:6cc3fedb2f33fa345d8b70d34f3b0251927c10d5c23a230e5bef56b655f0ee60","ref_id":"merged-pr-247-prime-integrity-gitea-phoenix-augmentation","uri":"tests/prime-program/test_targeted_validation.py"},{"authority":"EVIDENCE_POINTER","digest":"sha256:52e6b5037a17181737873aa03205e0e9a562651a7db6f364537ae8fa0e0a9b22","ref_id":"prime-ascendant-continuity-reconciliation","uri":"tests/prime-program/test_prime_ascendant_covenant.py"}],"gate":"PA-C01-COVENANT-REFINEMENT","lesson_harvest":{"no_lesson_reason":null,"observations":[{"disposition":"LOCAL_ONLY","golden_wing_id":null,"key":"asc-001-exact-sunset-cardinality","observation":"This semantic objective is a completed full Atlas Sunset and requires exactly one Feather, one Sunset, and one Sunrise with exact pair relationships.","rationale":"ASC-001 is applied by the canonical lifecycle generator, candidate cardinality assertions, schema validation, and exact Feather/Sunset/Sunrise relationship checks. The evidence is local to this transaction and does not establish a reusable Golden Wing."},{"disposition":"LOCAL_ONLY","golden_wing_id":null,"key":"asc-002-observations-do-not-self-promote","observation":"Observations and successful checks do not self-promote; the proportionate-validation lesson remains absorbed through merged source, enforcement behavior, and regression tests in PR #247.","rationale":"ASC-002 is applied by the active lesson-harvest protocol and assurance controls. No new Golden Wing is created because independent recurrence or a justified systemic exception is not established."}],"schema_id":"atlas.lifecycle.lesson-harvest","schema_version":"1.0.0"},"lifecycle_status":"SEALED","mission":"FULL-ATLAS-SUNSET-CHAT-CLOSEOUT-R01","next_approval_gate":"Independent exact-head hosted readback and Strikeforce disposition for this draft-PR publication only; any READY, MERGE, generated refresh, ruleset transition, Quest gate advancement, runtime, Gitea, cutover, or route-retirement action requires separate Jayson authority.","next_safe_action":"After this draft PR reaches unchanged exact-head hosted proof and independent Strikeforce readback, stop at the draft-PR boundary. If separately merged later, create one separate generated-only refresh transaction from the Sunset merge commit and prove generated CURRENT; do not advance PA-C01 or perform runtime, Gitea, cutover, settings, ruleset, or route-retirement work.","operation_id":"operation-nexus","project_id":"project-artemis","protected_data":{"classification":"INTERNAL_CLEAN","clean_summary":"Only sanitized doctrine, public repository identities, merged-PR evidence references, lifecycle state, unresolved work, and restart guidance are included. No credentials, tokens, keys, MFA or recovery codes, private network values, PHI, raw finance or account evidence, private exports, or unredacted logs are stored.","protected_pointers":[]},"quest_scope":{"quest_id":"prime-ascendant","scope_type":"ADMITTED_QUEST"},"record_id":"FTR-DI2NRWYNLEBRSNY7TX6F4YIFMY","schema_id":"atlas.lifecycle.feather","schema_version":"2.0.0","supersession_lineage":{"superseded_by":null,"supersedes":["FTR-SCFUZB37GJBLW4SL2JSH32LQBP"]}}
