{"authority":"CANONICAL_RECORD","campaign":"CIEL-C01","concurrency":{"declared_source_fingerprint":"sha256:19f3d1f49bee9198aa00ef9ce4069392922737cd4d8a52c46fdef9910a6ecf48","expected_main_sha":"a59ccde1dc6350e353f65c6e47a040f0e9627720","expected_parent_feather":null,"expected_quest_revision":null},"context_summary":"Create one full Atlas Sunset preserving the completed Ciel's Awakening and First Gluttony restart context, Operation Ciel, Harvest to Absorb, Gluttony, noncanonical Rimuru, exact source and Mission identities, validation and rollback evidence, and the completed Quest's historical posture without claiming runtime, protected action, Quest advancement, or Golden Wing promotion.","durable_source_references":[{"authority":"CANONICAL_SOURCE","ref_id":"ciels-awakening-quest-history","uri":"quests/ciels-awakening.md"},{"authority":"CANONICAL_SOURCE","ref_id":"operation-ciel","uri":"operations/ciel.md"},{"authority":"CANONICAL_SOURCE","ref_id":"rimuru-registry","uri":"knowledge/rimuru/registry-r01.json"},{"authority":"CANONICAL_SOURCE","ref_id":"lifecycle-contract","uri":"lifecycle/lifecycle-contract.md"},{"authority":"CANONICAL_SOURCE","ref_id":"lesson-harvest-protocol","uri":"governance/lesson-harvest-protocol.md"},{"authority":"CANONICAL_SOURCE","ref_id":"mission-first-chat-handoff","uri":"governance/mission-first-chat-handoff-contract.md"}],"evidence_pointers":[],"gate":"SUNSET-CANONICAL-READBACK","lesson_harvest":{"no_lesson_reason":null,"observations":[{"disposition":"NEW_CANDIDATE","golden_wing_id":null,"key":"ciel-prepublication-semantic-validation","observation":"Investigate prepublication canonical validation because two semantic defects in First Gluttony were detected only after pull-request CI.","rationale":"This remains a follow-up obligation only and does not create or promote a Golden Wing or assurance control."},{"disposition":"LOCAL_ONLY","golden_wing_id":null,"key":"ciel-zero-delta-tree-readback","observation":"Candidate-to-merge tree comparison with zero changed files provided stronger merge proof than the merged flag alone.","rationale":"Preserve this transaction-specific proof lesson without promoting it."},{"disposition":"LOCAL_ONLY","golden_wing_id":null,"key":"ciel-append-only-completion-receipts","observation":"Append-only completion receipts preserved original Mission and Quest manifests while merged Prime carried final authority.","rationale":"Preserve this transaction-specific continuity lesson without promoting it."},{"disposition":"LOCAL_ONLY","golden_wing_id":null,"key":"ciel-strikeforce-pass-five","observation":"Noctua initially missed two semantic defects; Ares and Aegis kept repair bounded; exact-head Strikeforce reached GREEN on Pass 5 of 5.","rationale":"Preserve the accepted Strikeforce lesson without changing assurance controls."}],"schema_id":"atlas.lifecycle.lesson-harvest","schema_version":"1.0.0"},"lifecycle_status":"SEALED","mission":"CIEL-C01-M02 - First Gluttony / Mission #332 Sunset","next_approval_gate":"Any future Golden Wing or assurance-control promotion, implementation Mission, runtime action, protected-data access, Quest reactivation, or infrastructure action requires a separate exact Jayson approval.","next_safe_action":"After exact merged-main readback closes Mission #332, preserve the prepublication-validation NEW_CANDIDATE as an unpromoted follow-up and admit it only through a separate public-clean Mission and Preview if Jayson chooses to pursue it.","operation_id":"operation-ciel","project_id":"project-artemis","protected_data":{"classification":"INTERNAL_CLEAN","clean_summary":"Only public-clean Atlas decisions, repository and Mission identities, source paths, hashes, validation results, sanitized lessons, recovery, and rollback are included. Secrets, credentials, PHI, raw financial, legal, tax, insurance, brokerage, account, private network, private runtime, raw export, personal archive, and unrestricted log values are excluded.","protected_pointers":[]},"quest_scope":{"scope_type":"NON_QUEST","work_scope":"Completed Ciel's Awakening and First Gluttony historical closeout under Operation Ciel."},"record_id":"FTR-CI5JXXF4TLBKDP25GEY32QP3CD","schema_id":"atlas.lifecycle.feather","schema_version":"2.0.0","supersession_lineage":{"superseded_by":null,"supersedes":[]}}
